{
  "id": "com.vihara.sample.mindful-focus",
  "schema_version": "1.0.0",
  "name": "Mindful Focus Starter Pack",
  "version": "1.0.0",
  "brand_track": "universal",
  "author": {
    "name": "Vihara Team",
    "url": "https://vihara.com",
    "email": "packs@vihara.com"
  },
  "description": "The official starter pack combining calm mindfulness reflections with gentle cognitive drift disruption for knowledge workers and developers.",
  "license": "CC-BY-4.0",
  "content_rating": "everyone",
  "tier_requirement": "free",
  "ui_theme": {
    "bg_color": "#18181b",
    "header_color": "#27272a",
    "text_color": "#f4f4f5",
    "accent_color": "#3b82f6",
    "font_family": "Segoe UI",
    "corner_radius": 10,
    "sound_volume": 0.4
  },
  "preview": {
    "icon": "icon.png",
    "banner": "preview.png"
  },
  "vibes": {
    "FLOW_STATE": {
      "folder": "memes/flow_state",
      "audio_cue": "audio/soft_chime.wav",
      "reflections": [
        "the zone. you are in it.",
        "fingers moving, thoughts flowing effortlessly.",
        "you and the problem have reached an understanding."
      ],
      "contextual_templates": [
        "locked into '{subject}' with deep focus",
        "making effortless headway on '{subject}'"
      ],
      "assets": [
        {
          "filename": "flow_state_zen.png",
          "sha256": "e3b0c44298fc1c149afbf4c8996fb92427ae41e4649b934ca495991b7852b855",
          "caption": "Deep waters running silent"
        }
      ]
    },
    "GRINDING": {
      "folder": "memes/grinding",
      "audio_cue": "audio/soft_chime.wav",
      "reflections": [
        "still here. still putting in the reps.",
        "steady cadence, relentless momentum.",
        "brick by brick, the foundation is built."
      ],
      "contextual_templates": [
        "chipping away at '{subject}'",
        "deep in the trenches of '{subject}'"
      ]
    },
    "BURNOUT_APPROACHING": {
      "folder": "memes/burnout_approaching",
      "audio_cue": "audio/soft_chime.wav",
      "reflections": [
        "your future self would appreciate some water.",
        "your shoulders are up near your ears. drop them.",
        "running on fumes only works until the tank is dry."
      ],
      "contextual_templates": [
        "'{subject}' will still be here after you take a breath",
        "step away from '{subject}' for three minutes"
      ]
    },
    "SYNTAX_RAGE": {
      "folder": "memes/syntax_rage",
      "audio_cue": "audio/soft_chime.wav",
      "reflections": [
        "you and the compiler are having a moment.",
        "that backspace key is doing Olympic cardio.",
        "somewhere, a rubber duck is genuinely concerned."
      ],
      "contextual_templates": [
        "staring at '{subject}' like it owes you rent",
        "you vs '{subject}' — round 7"
      ],
      "assets": [
        {
          "filename": "syntax_rage.png",
          "sha256": "4a5b6c7d8e9f0123456789abcdef0123456789abcdef0123456789abcdef0123",
          "caption": "When the semicolon is missing"
        }
      ]
    },
    "HELP_SEEKING": {
      "folder": "memes/help_seeking",
      "audio_cue": "audio/soft_chime.wav",
      "reflections": [
        "the sacred pilgrimage to documentation.",
        "someone in 2014 had this exact problem. find them.",
        "wisdom begins with admitting we do not know."
      ],
      "contextual_templates": [
        "consulting the ancients regarding '{subject}'",
        "gathering external brains for '{subject}'"
      ]
    },
    "MOUNTING_FRICTION": {
      "folder": "memes/mounting_friction",
      "audio_cue": "audio/soft_chime.wav",
      "reflections": [
        "breathe. the friction is information, not an enemy.",
        "resistance is a signal to slow down, not push harder.",
        "the obstacle is just a question you haven't phrased yet."
      ],
      "contextual_templates": [
        "hitting a temporary wall on '{subject}'",
        "friction detected in '{subject}' — pause and reset"
      ]
    },
    "WANDERING": {
      "folder": "memes/wandering",
      "audio_cue": "audio/soft_chime.wav",
      "reflections": [
        "productive procrastination has quietly entered the chat.",
        "curiosity is good; wandering without a compass is drift.",
        "a scenic detour from your original intention."
      ],
      "contextual_templates": [
        "briefly orbiting '{subject}'",
        "meandering gently through '{subject}'"
      ]
    },
    "LOST_IN_SCROLL": {
      "folder": "memes/lost_in_scroll",
      "audio_cue": "audio/soft_chime.wav",
      "reflections": [
        "just five more minutes... forty minutes ago.",
        "the infinite scroll has no bottom. you have to stop it.",
        "the algorithm handed you an endless feed and you took it."
      ],
      "contextual_templates": [
        "immersed in the infinite stream of '{subject}'",
        "deep in the rabbit hole of '{subject}'"
      ],
      "assets": [
        {
          "filename": "lost_in_scroll.png",
          "sha256": "8f4e2c91b5d6e7f8a9b0c1d2e3f4a5b6c7d8e9f0123456789abcdef012345678",
          "caption": "The endless thumb flick"
        }
      ]
    },
    "TAB_BUTTERFLY": {
      "folder": "memes/tab_butterfly",
      "audio_cue": "audio/soft_chime.wav",
      "reflections": [
        "the browser has 53 tabs. surely you need 54.",
        "tab hoarding is emotional support for unresolved questions.",
        "flitting from idea to idea without landing."
      ],
      "contextual_templates": [
        "adding '{subject}' to the tab museum",
        "another tab opened for '{subject}'"
      ]
    },
    "STILLNESS": {
      "folder": "memes/stillness",
      "audio_cue": "audio/soft_chime.wav",
      "reflections": [
        "away. being a human for a moment.",
        "silence on the keyboard. quiet in the mind.",
        "the space between actions is where recovery happens."
      ],
      "contextual_templates": [
        "resting after working on '{subject}'",
        "stillness observing '{subject}'"
      ]
    },
    "MEETING_RECOVERY": {
      "folder": "memes/meeting_recovery",
      "audio_cue": "audio/soft_chime.wav",
      "reflections": [
        "survived another meeting that could have been a silent note.",
        "cognitive bandwidth restoring... please wait.",
        "decompression protocol engaged."
      ],
      "contextual_templates": [
        "recovering from a sync regarding '{subject}'",
        "clearing your mind after '{subject}'"
      ]
    },
    "AFTERNOON_DRIFT": {
      "folder": "memes/afternoon_drift",
      "audio_cue": "audio/soft_chime.wav",
      "reflections": [
        "post-lunch autopilot fully engaged.",
        "circadian dip: your brain is politely requesting tea.",
        "the 3 PM fog is normal. give yourself some grace."
      ],
      "contextual_templates": [
        "drifting through '{subject}' on low power",
        "gently cruising through '{subject}'"
      ]
    }
  },
  "asset_hashes": {
    "memes/lost_in_scroll.png": "8f4e2c91b5d6e7f8a9b0c1d2e3f4a5b6c7d8e9f0123456789abcdef012345678",
    "memes/syntax_rage.png": "4a5b6c7d8e9f0123456789abcdef0123456789abcdef0123456789abcdef0123",
    "audio/soft_chime.wav": "c2b3a4d5e6f708192a3b4c5d6e7f8a9b0c1d2e3f4a5b6c7d8e9f0123456789ab"
  }
}
